[{"name":"test","description":"test","TH":"3","processes":[{"PID":"1335","COMMAND":"d","USER":["fabiloco"],"NI":"0","VSZ":"155640","RSS":"155640","STAT":["155640","5804","Ssl","18:30:22","00:00:00","/usr/lib/dconf-service"],"STARTED":"155640","TIME":"155640","CMD":"155640","burstTime":1227,"status":"ready","absoluteDescription":"Catalog info: \ntest\n\nProcess description: \nPID: 1335,\n         %CPU: undefined,\n          %MEM: undefined,\n           COMMAND: d,\n            USER: fabiloco,\n             NI: 0,\n              VSZ: 155640,\n               RSS: 155640,\n                STAT: 155640,5804,Ssl,18:30:22,00:00:00,/usr/lib/dconf-service,\n                 STARTED: 155640,\n                  TIME: 155640,\n                   CMD: 155640","cycle":0,"text":"","finished":0,"start":0,"percent":0},{"PID":"1393","COMMAND":"c","USER":["fabiloco"],"NI":"0","VSZ":"38428072","RSS":"38428072","STAT":["38428072","174192","SLsl","18:30:26","00:00:11","/opt/visual-studio-code/code","--unity-launch","--enable-crashpad"],"STARTED":"38428072","TIME":"38428072","CMD":"38428072","burstTime":1389,"status":"ready","absoluteDescription":"Catalog info: \ntest\n\nProcess description: \nPID: 1393,\n         %CPU: undefined,\n          %MEM: undefined,\n           COMMAND: c,\n            USER: fabiloco,\n             NI: 0,\n              VSZ: 38428072,\n               RSS: 38428072,\n                STAT: 38428072,174192,SLsl,18:30:26,00:00:11,/opt/visual-studio-code/code,--unity-launch,--enable-crashpad,\n                 STARTED: 38428072,\n                  TIME: 38428072,\n                   CMD: 38428072","cycle":0,"text":"","finished":0,"start":0,"percent":0},{"PID":"1396","COMMAND":"c","USER":["fabiloco"],"NI":"0","VSZ":"33814044","RSS":"33814044","STAT":["33814044","51500","S","18:30:26","00:00:00","/opt/visual-studio-code/code","--type=zygote","--no-zygote-sandbox","--enable-crashpad","--enable-crashpad"],"STARTED":"33814044","TIME":"33814044","CMD":"33814044","burstTime":1488,"status":"ready","absoluteDescription":"Catalog info: \ntest\n\nProcess description: \nPID: 1396,\n         %CPU: undefined,\n          %MEM: undefined,\n           COMMAND: c,\n            USER: fabiloco,\n             NI: 0,\n              VSZ: 33814044,\n               RSS: 33814044,\n                STAT: 33814044,51500,S,18:30:26,00:00:00,/opt/visual-studio-code/code,--type=zygote,--no-zygote-sandbox,--enable-crashpad,--enable-crashpad,\n                 STARTED: 33814044,\n                  TIME: 33814044,\n                   CMD: 33814044","cycle":0,"text":"","finished":0,"start":0,"percent":0}]},{"uuidv4":"e73ca940-c1e2-4590-8cdf-75a5bc85a462","name":"max cpu","description":"max cpu","TH":"12","processes":[{"PID":"144615","COMMAND":"a","USER":["fabiloco"],"NI":"0","VSZ":"572032","RSS":"572032","STAT":["572032","565132","R","15:00:09","00:00:03","as","-I","/home/fabiloco/watchman","-I",".","-I","/home/fabiloco/watchman/external/install/include","-I","/tmp/fbcode_builder_getdeps-ZhomeZfabilocoZwatchmanZbuildZfbcode_builder/installed/googletest-XinUDjCSpx0hIXh6tOT8z0YKhaRR5jZKLtm_4fsbXJk/include","--gdwarf-5","--64","-o","CMakeFiles/eden_service_thrift.dir/eden/fs/service/gen-cpp2/eden_types.cpp.o","/tmp/ccGGhGsJ.s"],"STARTED":"572032","TIME":"572032","CMD":"572032","burstTime":8880,"status":"ready","absoluteDescription":"Catalog info: \nmax cpu\n\nProcess description: \nPID: 144615,\n         %CPU: undefined,\n          %MEM: undefined,\n           COMMAND: as,\n            USER: fabiloco,\n             NI: 0,\n              VSZ: 572032,\n               RSS: 572032,\n                STAT: 572032,565132,R,15:00:09,00:00:03,as,-I,/home/fabiloco/watchman,-I,.,-I,/home/fabiloco/watchman/external/install/include,-I,/tmp/fbcode_builder_getdeps-ZhomeZfabilocoZwatchmanZbuildZfbcode_builder/installed/googletest-XinUDjCSpx0hIXh6tOT8z0YKhaRR5jZKLtm_4fsbXJk/include,--gdwarf-5,--64,-o,CMakeFiles/eden_service_thrift.dir/eden/fs/service/gen-cpp2/eden_types.cpp.o,/tmp/ccGGhGsJ.s,\n                 STARTED: 572032,\n                  TIME: 572032,\n                   CMD: 572032","cycle":0,"text":"","finished":0,"start":0,"percent":0},{"PID":"3159","COMMAND":"D","USER":["fabiloco"],"NI":"0","VSZ":"55452604","RSS":"55452604","STAT":["55452604","350452","Sl","13:47:34","00:38:48","/opt/discord/Discord","--type=renderer","--autoplay-policy=no-user-gesture-required","--field-trial-handle=12684839888501093780,11940384495509546509,131072","--disable-features=CookiesWithoutSameSiteMustBeSecure,HardwareMediaKeyHandling,MediaSessionService,SameSiteByDefaultCookies,SpareRendererForSitePerProcess,WinRetrieveSuggestionsOnlyOnDemand","--lang=en-US","--enable-crash-reporter=abaf68a6-edda-455a-8a02-e52608cf9838,no_channel","--global-crash-keys=abaf68a6-edda-455a-8a02-e52608cf9838,no_channel,_companyName=Discord","Inc.,_productName=Discord,_version=0.0.21","--app-path=/opt/discord/resources/app.asar","--no-sandbox","--no-zygote","--num-raster-threads=4","--enable-main-frame-before-activation","--renderer-client-id=7","--no-v8-untrusted-code-mitigations","--shared-files=v8_context_snapshot_data:100","--enable-node-leakage-in-renderers"],"STARTED":"55452604","TIME":"55452604","CMD":"55452604","burstTime":14760,"status":"ready","absoluteDescription":"Catalog info: \nmax cpu\n\nProcess description: \nPID: 3159,\n         %CPU: undefined,\n          %MEM: undefined,\n           COMMAND: Discord,\n            USER: fabiloco,\n             NI: 0,\n              VSZ: 55452604,\n               RSS: 55452604,\n                STAT: 55452604,350452,Sl,13:47:34,00:38:48,/opt/discord/Discord,--type=renderer,--autoplay-policy=no-user-gesture-required,--field-trial-handle=12684839888501093780,11940384495509546509,131072,--disable-features=CookiesWithoutSameSiteMustBeSecure,HardwareMediaKeyHandling,MediaSessionService,SameSiteByDefaultCookies,SpareRendererForSitePerProcess,WinRetrieveSuggestionsOnlyOnDemand,--lang=en-US,--enable-crash-reporter=abaf68a6-edda-455a-8a02-e52608cf9838,no_channel,--global-crash-keys=abaf68a6-edda-455a-8a02-e52608cf9838,no_channel,_companyName=Discord,Inc.,_productName=Discord,_version=0.0.21,--app-path=/opt/discord/resources/app.asar,--no-sandbox,--no-zygote,--num-raster-threads=4,--enable-main-frame-before-activation,--renderer-client-id=7,--no-v8-untrusted-code-mitigations,--shared-files=v8_context_snapshot_data:100,--enable-node-leakage-in-renderers,\n                 STARTED: 55452604,\n                  TIME: 55452604,\n                   CMD: 55452604","cycle":0,"text":"","finished":0,"start":0,"percent":0},{"PID":"1835","COMMAND":"c","USER":["fabiloco"],"NI":"0","VSZ":"38177720","RSS":"38177720","STAT":["38177720","284580","Sl","13:47:06","00:28:31","/opt/visual-studio-code/code","--ms-enable-electron-run-as-node","--max-old-space-size=3072","/opt/visual-studio-code/resources/app/extensions/node_modules/typescript/lib/tsserver.js","--useInferredProjectPerProjectRoot","--enableTelemetry","--cancellationPipeName","/tmp/vscode-typescript1000/ce192e7aad8dc04009a6/tscancellation-b8f3c1572b3ec8ce8ac0.tmp*","--locale","en","--noGetErrOnBackgroundUpdate","--validateDefaultNpmLocation","--useNodeIpc"],"STARTED":"38177720","TIME":"38177720","CMD":"38177720","burstTime":9960,"status":"ready","absoluteDescription":"Catalog info: \nmax cpu\n\nProcess description: \nPID: 1835,\n         %CPU: undefined,\n          %MEM: undefined,\n           COMMAND: code,\n            USER: fabiloco,\n             NI: 0,\n              VSZ: 38177720,\n               RSS: 38177720,\n                STAT: 38177720,284580,Sl,13:47:06,00:28:31,/opt/visual-studio-code/code,--ms-enable-electron-run-as-node,--max-old-space-size=3072,/opt/visual-studio-code/resources/app/extensions/node_modules/typescript/lib/tsserver.js,--useInferredProjectPerProjectRoot,--enableTelemetry,--cancellationPipeName,/tmp/vscode-typescript1000/ce192e7aad8dc04009a6/tscancellation-b8f3c1572b3ec8ce8ac0.tmp*,--locale,en,--noGetErrOnBackgroundUpdate,--validateDefaultNpmLocation,--useNodeIpc,\n                 STARTED: 38177720,\n                  TIME: 38177720,\n                   CMD: 38177720","cycle":0,"text":"","finished":0,"start":0,"percent":0}]}]